Candidato,Setorial,Estado,Situação,Votos
GILVAN GOMES DA SILVA (Gilvan Gomes da Silva) ,Culturas Populares ,PE ,Habilitado ,22
GISLAINE TEIXEIRA CAMPOS (Lanna Campos) ,Culturas Populares ,RS ,Habilitado ,78
GLAUCIO TEIXEIRA DA CAMARA (Gláucio Teixeira da Câmara) ,Culturas Populares ,RN ,Eleito ,63
GLORIA RODRIGUES SERRA (Glória Rodrigues) ,Culturas Populares ,RR ,Eleito ,33
GUARAPIRANGA FREIRE (Guará Freire) ,Culturas Populares ,DF ,Eleito ,70
HENRIQUE JORGE PONTES SAMPAIO (Henrique Jorge Pontes Sampaio) ,Culturas Populares ,PB ,Habilitado ,10
IRAN LIMA DE SOUSA (Iran Lima de Sousa) ,Culturas Populares ,AP ,Eleito ,354
IZABEL CRISTINA SANTANA DO NASCIMENTO (Izabel Cristina Santana do Nascimento) ,Culturas Populares ,SE ,Habilitado ,93
JACILDO BEZERRA (Jacildo Bezerra) ,Culturas Populares ,RR ,Habilitado ,32
JACKSON CONRADO BESERRA (Jackson Conrado Bezerra) ,Culturas Populares ,RR ,Habilitado ,1
JOANA ALVES DA SILVA (Joana Alves da Silva) ,Culturas Populares ,PB ,Habilitado ,0
JOCELINO DA CONCEICAO SILVA JUNIOR (JOCELINO JÚNIOR) ,Culturas Populares ,ES ,Eleito ,4
JOSE ANTONIO PINHEIRO JUNIOR (José Antonio Pinheiro Junior (Catatau)) ,Culturas Populares ,MA ,Eleito ,89
JOSE CARLOS DANTAS (José Carlos Dantas) ,Culturas Populares ,RN ,Eleito ,8
JOSE DE ARIMATEA DE VASCONCELOS TEIXEIRA (jose de arimatéa de vasconcelos teixeira) ,Culturas Populares ,AL ,Eleito ,43
JOSE DIAS CARDOSO NETO (josé dias cardoso neto) ,Culturas Populares ,DF ,Habilitado ,53
JOSE EDUARDO ARAUJO BORGES (JOSÉ EDUARDO ARAUJO BORGES -ALEMÃO) ,Culturas Populares ,PI ,Habilitado ,2
JOSE LIMA DOS SANTOS (Jose Lima dos Santos - Mestre Zé da Viola) ,Culturas Populares ,RR ,Eleito ,120
JOSE MARCOS PIRES BUENO (José Marcos Pires Bueno) ,Culturas Populares ,SP ,Habilitado ,68
JOSE RODRIGUES ARIMATEIA (Ogan Arimatéia) ,Culturas Populares ,AC ,Habilitado ,13
JOSE RUITER VASCONCELOS CERQUEIRA JUNIOR (Ruiter Durdevic) ,Culturas Populares ,RJ ,Habilitado ,2
JOSE SANTANA PACHECO (José Santana Pacheco) ,Culturas Populares ,RO ,Habilitado ,49
JOSICLEIA DOS SANTOS FERREIRA (Josicléia dos Santos Ferreira) ,Culturas Populares ,AP ,Eleito ,40
JOSIVALDO ARAUJO DE SOUSA (Josivaldo Araujo de Sousa - J.Ivo Brasil) ,Culturas Populares ,SP ,Habilitado ,30
JURANDIR AMADEU GOMES PINTO (Jurandir Bozo ) ,Culturas Populares ,AL ,Eleito ,148
KEILA DE OLIVEIRA SILVA CARNIETTO (Keila - Pê Oliveira) ,Culturas Populares ,SP ,Habilitado ,0
LEANDRO ALVES DE OLIVEIRA (Leandro Alves de Oliveira) ,Culturas Populares ,RJ ,Habilitado ,14
LENILTON DE SOUZA LIMA (lenilton de Souza Lima) ,Culturas Populares ,RN ,Habilitado ,33
LILIAN MAIA RABELLO (Lilian Rabello) ,Culturas Populares ,RJ ,Habilitado ,16
LUCAS ALVES DE VASCONCELOS (LUCAS ALVES DE VASCONCELOS) ,Culturas Populares ,PE ,Habilitado ,3
LUCIANA CARVALHO DE MATTOS (Luciana Carvalho de Mattos (Luciana Dara)) ,Culturas Populares ,SP ,Habilitado ,11
LUCIANO ACCIOLE GOMES (Luciano Acciole Gomes) ,Culturas Populares ,SE ,Eleito ,213
LUIS EUGENIO OLIVEIRA SOUZA (LUIS EUGÊNIO OLIVEIRA SOUZA) ,Culturas Populares ,DF ,Habilitado ,38
LUIZ ANTONIO DE ALBUQUERQUE LINS FILHO (Luizinho Lins) ,Culturas Populares ,PA ,Habilitado ,47
LUIZ GONZAGA MEDEIROS (LUIZ GONZAGA MEDEIROS) ,Culturas Populares ,MG ,Eleito ,125
LYDIA LUCIA NUNES DE SOUSA (Lydia Lucia Nunes de Sousa) ,Culturas Populares ,AM ,Habilitado ,6
MANOEL AGUINALDO FARIAS PINTO (MANOEL AGUINADO FARIAS PINTO) ,Culturas Populares ,PA ,Eleito ,113
MARCELO SIDNEY DOS REIS COSTA (marcelo do sax) ,Culturas Populares ,PA ,Habilitado ,2
MARCIO DOS SANTOS MEIRA (marcio dos santos meira) ,Culturas Populares ,PE ,Habilitado ,5
MARCO ANTONIO SOUZA DE ARAUJO (Marco Antonio Souza de Araújo) ,Culturas Populares ,PA ,Eleito ,77
MARCOS LEONI CORDEIRO DE MORAES (Marcos Leoni Moraes) ,Culturas Populares ,RJ ,Habilitado ,1
MARCOS RONILSON DO NASCIMENTO (MARCOS RONILSON DO NASCIMENTO) ,Culturas Populares ,MA ,Eleito ,85
MARCOS VINICIUS FERREIRA (Marcos Vinicius Ferreira) ,Culturas Populares ,PI ,Eleito ,128
MARIA CRISTINA DOS SANTOS BARROS (Cristina Barros) ,Culturas Populares ,BA ,Habilitado ,106
MARIA DE NAZARE DO O RIBEIRO (MARIA DE NAZARÉ DO Ó RIBEIRO) ,Culturas Populares ,PA ,Habilitado ,23
MARIA DOS PRAZERES F BARROS (Maria dos Prazeres Firmino de Barros) ,Culturas Populares ,PE ,Habilitado ,66
MARIA JANE SOARES TARGINO CAVALCANTI (Maria Jane Soares Targino Cavalcante) ,Culturas Populares ,PB ,Eleito ,74
MARIA JOSE FERREIRA DA SILVA (MARIA JOSÉ FERREIRA DA SILVA (Zeza do Coco)) ,Culturas Populares ,AL ,Habilitado ,1
MARIAH AGATHA JEREMIAS DE SOUZA LIMA (Mariah Agatha Jeremias de Souza Lima) ,Culturas Populares ,SP ,Habilitado ,5
MAURO ANDRE VIANA PINTO (Mauro André Viana Pinto) ,Culturas Populares ,MA ,Habilitado ,6
NAZARENO GOMES DA SILVA (Nazareno Gomes da Silva) ,Culturas Populares ,PA ,Habilitado ,11
NEIVA MARIA ORTEGA MARQUES (Neiva Maria Ortega Marques) ,Culturas Populares ,SC ,Habilitado ,9
NELSON BRUM MOTTA (Nelson Brum Motta) ,Culturas Populares ,SC ,Habilitado ,127
OILSON ANTONIO ALVES (Will Capa Preta) ,Culturas Populares ,PR ,Habilitado ,7
OZIEL DOS SANTOS REIS (oziel dos santos reis) ,Culturas Populares ,GO ,Habilitado ,7
PAULO CESAR CAVALCANTE DOS SANTOS (Paulo Cesar Cavalcante dos Santos) ,Culturas Populares ,DF ,Eleito ,53
PAULO HENRIQUE SOARES DE ALMEIDA (PAULO HENRIQUE SOARES DE ALMEIDA) ,Culturas Populares ,DF ,Habilitado ,8
PAULO LUIS SILVA CORREA (PAULO CORRÊA) ,Culturas Populares ,RS ,Eleito ,114
PAULO MARQUES FERREIRA (PAULO MARQUES FERREIRA) ,Culturas Populares ,PE ,Habilitado ,23
PIERRE CESAR BENEDITO (Pierre Cesar) ,Culturas Populares ,SP ,Eleito ,75
RAIMUNDO DA SILVA MATOS (Raimundo da Silva Matos) ,Culturas Populares ,BA ,Inabilitado ,0
RENAN BARBOSA SILVA (Renan Barbosa Silva) ,Culturas Populares ,BA ,Habilitado ,2
RENATA OURO GONCALVES DA COSTA (RENATA OURO GONÇALVES DA COSTA ) ,Culturas Populares ,SE ,Habilitado ,22
RENATO FERNANDO MARQUES (RENATO FERNANDO MARQUES ) ,Culturas Populares ,RJ ,Habilitado ,71
RITA DE CASSIA COSTA BACELAR PINHEIRO (Rita Pinheiro ( Garimpeira da Cultura )) ,Culturas Populares ,BA ,Habilitado ,22
ROBSON DA COSTA DIAS (Robson da Costa Dias - Mestre Tio Robson) ,Culturas Populares ,RJ ,Eleito ,278
ROGERIO DIAS (Rogerio Dias) ,Culturas Populares ,AL ,Habilitado ,8
ROMARIO MONTEIRO FEITOSA (Romário Monteiro Feitosa) ,Culturas Populares ,AC ,Habilitado ,5
ROMILDA NETO PIZANI (Romilda) ,Culturas Populares ,MS ,Eleito ,16
ROSANA ALVES SOARES DE SOUZA (ROSANA SOARES OU ROSANA ALVES SOARES DE SOUZA) ,Culturas Populares ,PE ,Habilitado ,137
SAULO TOSCANO DE SOUZA (Saulo Toscano de Souza) ,Culturas Populares ,RO ,Habilitado ,4
SEBASTIAO ALBERTO VIEIRA DE MOURA (Sebastião Alberto Vieira de Moura - Sabá Moura) ,Culturas Populares ,RR ,Eleito ,204
SERGIO LUIZ BARRETO CAMPELLO CARDOSO AYRES (Sérgio Luiz Barreto Campello Cardoso Ayres) ,Culturas Populares ,MG ,Habilitado ,13
SEVERINO ANTONIO DA SILVA (SEVERINO ANTONIO DA SILVA (bibiu)) ,Culturas Populares ,PB ,Habilitado ,4
SEVERO DE SOUSA BARROS (Mestre Severo) ,Culturas Populares ,PI ,Habilitado ,39
SILVIO MACEDO DOS SANTOS (Silvio Macedo dos Santos) ,Culturas Populares ,RO ,Eleito ,59
SUSANA RODRIGUES LEITE JUNG (Susana Jung) ,Culturas Populares ,RS ,Habilitado ,34
SUZANA AVILA DA SILVA (Ekede Suzana) ,Culturas Populares ,SP ,Habilitado ,22
THEREZA CRISTINA MARTINS DANTAS (Thereza Cristina Matins Dantas) ,Culturas Populares ,RJ ,Habilitado ,26
TIAGO VITORIO MAIA (Tiago Maia) ,Culturas Populares ,ES ,Habilitado ,0
VALDIR RODRIGUES MIRANDA DA SILVA (Mestre Ninja ) ,Culturas Populares ,BA ,Habilitado ,94
VEGUINALDO RODRIGUES FILHO (DINHO RODRIGUES) ,Culturas Populares ,SP ,Habilitado ,26
VIRGILIO DE ALENCAR SANTANA (Virgilio de Alencar Santana) ,Culturas Populares ,GO ,Habilitado ,14
WILLEMBERG JUNIOR FRANCELINO DA SILVA (WILLEMBERG JUNIOR FRANCELINO DA SILVA) ,Culturas Populares ,PE ,Habilitado ,88
WILLIAM MORAES CORREA (WILLIAM MORAES CORRÊA) ,Culturas Populares ,MA ,Habilitado ,32
WILSON TAVARES DE SOUZA JUNIOR (WILSON TAVARES DE SOUZA JUNIOR) ,Culturas Populares ,AM ,Habilitado ,93
WLADIMIR SILVA FURTADO (WLADIMIR SILVA FURTADO) ,Culturas Populares ,AP ,Habilitado ,298
ADRIANE DE SOUZA SILVEIRA (Adriane Silveira) ,Dança ,RS ,Habilitado ,48
AGUINALDO COSTA DOS SANTOS (Aguinaldo Costa dos Santos ) ,Dança ,AP ,Habilitado ,32
ALDO GONCALVES CARDOSO JUNIOR (ALDO GONÇALVES) ,Dança ,RS ,Habilitado ,14
ALEXANDRE BATISTA REIS (Alexandre Reis) ,Dança ,BA ,Habilitado ,1
ALEXANDRE JOSE MOLINA (Alexandre Molina) ,Dança ,MG ,Eleito ,162
ALEXANDRO LEITE SANTIAGO (Alexandro Leite Santiago) ,Dança ,CE ,Eleito ,71
ANA CLEIA NERI ALVES (Cléia Alves) ,Dança ,AM ,Habilitado ,67
ANA PATRICIA VASCONCELLOS SHARP (Ana Sharp) ,Dança ,SP ,Habilitado ,27
ANA ROSANGELA COLARES LAVAND (Ana Rosangela Colares Lavand) ,Dança ,PA ,Eleito ,38
ANDREA DOS SANTOS MELO (Andréa dos Santos Melo) ,Dança ,RO ,Eleito ,90
ANDREA RECH BAPTISTA (Andrea Baptista) ,Dança ,SC ,Eleito ,25
ANDRESSA LAYSA QUEIROZ RIBEIRO (ANDRESSA LAYSA QUEIROZ RIBEIRO) ,Dança ,PE ,Eleito ,27
ANGELA SOUZA DE ARAUJO (Angela Souza de Araújo) ,Dança ,CE ,Habilitado ,12
ANTONIO GILBERTO SOUZA PAIVA (Antonio Gilberto) ,Dança ,AP ,Eleito ,61
ANTONIO JUNIOR DE SOUSA UCHOA (Antonio Junior de Sousa Uchoa) ,Dança ,AC ,Eleito ,33
ARIANE TRINDADE DE ALMEIDA (Ariane Trindade de Almeida Passos) ,Dança ,SE ,Habilitado ,2
CARLOS ALBERTO VIEIRA SOARES (CARLOS KISS) ,Dança ,SP ,Habilitado ,10
CINTIA RAFAELA BRAGHIM BELTRAN TAMIAO (CÍNTIA RAFAELA BRAGHIM BELTRAN TAMIÃO) ,Dança ,SP ,Habilitado ,10
CLAUDIA MARIA SANTOS PENICHE (CLÁUDIA MARIA SANTOS PENICHE) ,Dança ,PA ,Inabilitado ,32
CLEUSON CLAUDIO MARTINS LEAL (Cleuson Claudio Martins Leal) ,Dança ,AP ,Inabilitado ,123
CONCEICAO DE MARIA FORTES TORRES (Conceição de Maria Fortes Torres) ,Dança ,PI ,Habilitado ,2
DELMIRO JOSE CARVALHO FREITAS (Pai Delmiro Freitas) ,Dança ,RR ,Eleito ,112
DENIVAN COSTA DE LIMA (Denis Angola) ,Dança ,AL ,Habilitado ,5
DIANA PINHEIRO FONTES (Diana Pinheiro Fontes) ,Dança ,RN ,Eleito ,150
DIEGO WINCK ESTEVES (Diego Esteves) ,Dança ,RS ,Habilitado ,6
DOUGLAS RAFAEL CAVALCANTE DA SILVA (Douglas Rafael Cavalcante da Silva) ,Dança ,RR ,Habilitado ,101
EDEILSON MATIAS DA SILVA (Edeilson Matias da Silva) ,Dança ,RN ,Eleito ,153
EDIVALDO PINTO VIDEIRA (edivaldo pinto vdeira) ,Dança ,AP ,Eleito ,89
ELAINE PEREIRA GONCALVES (Elaine Pereira Gonçalves) ,Dança ,SC ,Habilitado ,5
ELEONORA FERREIRA LEAL (Eleonora Ferreira Leal) ,Dança ,PA ,Habilitado ,14
ELISANGELA JAWORSKI BORCHARD (Elisangela Jaworski Borchard) ,Dança ,SC ,Habilitado ,11
ELIZABETH QUIRINO BARROS (Elizabeth Quirino Barros) ,Dança ,GO ,Eleito ,85
ELTON DOUGLAS FIALHO BARATA (Elton Fialho) ,Dança ,TO ,Eleito ,4
ERIVELTO VIANA PINTO (Erivelto Viana) ,Dança ,MA ,Eleito ,5
ERMENEGILDA ALVES RIBEIRO (Ermenegilda Alves Ribeiro) ,Dança ,PI ,Inabilitado ,3
FILIPE MARTINIANO COUTO (Flip Couto) ,Dança ,SP ,Habilitado ,78
FRANCISCO ROGERS CAVALCANTI AYRES (FRANCISCO ROGERS CAVALCANTI AYRES) ,Dança ,AL ,Habilitado ,1
HELIJANE DE MENESES ROCHA (Helijane de Meneses Rocha) ,Dança ,PE ,Habilitado ,1
HELOISA HELENA ALVES DUQUE (Heloisa Helena Alves da Silva) ,Dança ,PE ,Habilitado ,6
HILDEGARDA BORGES SAMPAIO (Hildegarda Sampaio) ,Dança ,PI ,Eleito ,231
HUGO SILVA DE OLIVEIRA (Hugo de Oliveira) ,Dança ,RJ ,Eleito ,44
IGOR ORSOLON DO PRADO (Igor Orsolon) ,Dança ,SP ,Habilitado ,34
IMIRA REIS BRITO (Imira Brito) ,Dança ,MA ,Eleito ,45
JACSON DO ESPIRITO SANTO (Jacson do Espírito Santo) ,Dança ,BA ,Eleito ,43
JAILSON CORDEIRO (Jailson Cordeiro) ,Dança ,SC ,Habilitado ,1
JAMILTON DE MELO CAMPOS (JAMILTON DE MELO CAMPOS) ,Dança ,MT ,Eleito ,41
JEFERSON VIEIRA DA SILVA (jeferson vieira) ,Dança ,RO ,Inabilitado ,4
JOAO FERNANDES NETO (JOÃO FERNANDES NETO) ,Dança ,AM ,Eleito ,74
JUCICLEIDE FACANHA DE ALMEIDA (Jucicleide Façanha de Almeida) ,Dança ,AP ,Habilitado ,40
KELSON JOEMIR PANOSSO DOS PASSOS (KELSON JOEMIR PANOSSO DOS PASSOS) ,Dança ,MT ,Habilitado ,17
KLEBER SANTANA SOARES (Kleber santana ) ,Dança ,DF ,Inabilitado ,16
LAIS DA SILVA TAVARES (Laís da Silva Tavares) ,Dança ,AL ,Habilitado ,60
LEANDRO BARROS DANTAS (Leandro Barros Dantas) ,Dança ,AP ,Habilitado ,33
LIVEA CASTRO CALVO (Lívea Castro Calvo) ,Dança ,PR ,Habilitado ,10
LUIZ GUSTAVO DALAZEN FERNANDES (Luiz Gustavo Dalazen Fernandes) ,Dança ,PR ,Habilitado ,3
MARCELA SILVA BRASIL (Marcela Silva Brasil) ,Dança ,RJ ,Habilitado ,34
MARCELLA SOUZA CARVALHO (MARCELLA SOUZA CARVALHO) ,Dança ,PR ,Eleito ,95
MARCIO ANTONIO PEREIRA DA COSTA (MARCIO COSTA) ,Dança ,RR ,Eleito ,251
MARCOS FLAVIO DE MATOS BEZERRA (Marcos Flávio de Matos Bezerra) ,Dança ,MS ,Eleito ,51
MARIA DA CONCEICAO SANTOS COSTA (Maria da Conceição Santos Costa) ,Dança ,BA ,Inabilitado ,10
MARIA JOSE FREITAS DA SILVA (Maria José Freitas da Silva) ,Dança ,AC ,Eleito ,170
MATEUS DOS SANTOS GALUCIO (Boto) ,Dança ,PA ,Inabilitado ,3
MATHEUS DE LUCA FARIA AGUIAR (Matheus de Luca Aguiar) ,Dança ,MT ,Habilitado ,38
MAURICIO MORAES MOTTA (Mauricio Moraes Motta) ,Dança ,RN ,Habilitado ,12
MAURICIO REIS MACIEL (Maurício Reis Maciel) ,Dança ,AP ,Habilitado ,46
NARA CLAUDIA TEIXEIRA BARBOSA (Nara Claudia Teixeira Barbosa) ,Dança ,RO ,Eleito ,78
NATAN ANDRADE MARCACINE (Natan Andrade Marcacine ) ,Dança ,MG ,Eleito ,24
NEILA CRISTINA BALDI (Neila Baldi) ,Dança ,BA ,Habilitado ,2
NEIVA MARIA DE ABREU VOIGT (Neiva Maria de Abreu Voigt) ,Dança ,RJ ,Habilitado ,23
NELSON GONCALVES CAMPOS FILHO (Nelson Triunfo) ,Dança ,SP ,Habilitado ,38
NILCILENE BARROSO MATOS (Mãe Awrá) ,Dança ,AC ,Habilitado ,20
NIRLYN KARINA SEIJAS CASTILLO (Nirlyn Seijas) ,Dança ,BA ,Habilitado ,8
PABLO ALEJANDRO TORRES INSAURRALDE (Pablo torres) ,Dança ,RS ,Habilitado ,14
PATRICIA LIMA VALES (Patricia Lima Vales) ,Dança ,AP ,Eleito ,99
PAULO ANDRE AGUIAR DE SANTANA FILHO (André Aguiar) ,Dança ,PE ,Habilitado ,13
PAULO ROBERTO LIMA DE SOUZA (PAULO LIMA) ,Dança ,CE ,Habilitado ,58
RAPHAELA BARBOZA LIMA DA SILVA (raphaela barboza lima da silva) ,Dança ,SP ,Habilitado ,2
REGINA CLAUDIA MORAIS DE SOUZA (Regina Cláudia Morais de Souza) ,Dança ,AC ,Eleito ,152
REINALDO ALBERTO GONCALVES DO NASCIMENTO (Burú do Guamá) ,Dança ,PA ,Inabilitado ,129
RENATA MATHIAS DE MOURA (Renata Mathias de Moura) ,Dança ,RS ,Habilitado ,50
RENATO PEREIRA DOS SANTOS (Renato Santos) ,Dança ,ES ,Eleito ,4
ROBERTHA SANTOS CARNEIRO (Robertha Carneiro) ,Dança ,SP ,Habilitado ,8
RONIE CHARLES DE LIMA (ronie charles lima) ,Dança ,SE ,Eleito ,64
RONILDO CABRAL DE SOUSA (Ronildo Cabral de Sousa) ,Dança ,PB ,Eleito ,4
ROSA MARIA LEONARDO COIMBRA (Rosa Coimbra) ,Dança ,DF ,Eleito ,51
ROUSEJANNY DA SILVA FERREIRA (Rousejanny da Silva Ferreira) ,Dança ,GO ,Eleito ,23
SANDRA APARECIDA BERNARDO (Sandra A Bernardo) ,Dança ,SP ,Eleito ,166
SANDRO BORELLI (Sandro Borelli) ,Dança ,SP ,Habilitado ,97
SILVANIA DA CRUZ REIS (Silvania da Cruz Reis) ,Dança ,BA ,Habilitado ,30
SIMONE RIBEIRO (simone Ribeiro) ,Dança ,RS ,Eleito ,60
SOLANGE CONCEICAO LOUREIRO MONTEIRO (SOLANGE CONCEIÇÃO LOUREIRO MONTEIRO) ,Dança ,PA ,Eleito ,226
TALYENE CRUZ MELONIO (TALYENE MELONIO) ,Dança ,MA ,Habilitado ,5
THIAGO SANTOS SITINETA (Thiago Santos Sitineta) ,Dança ,SE ,Habilitado ,11
VALERIA MARIA SILTON PINHEIRO (VALERIA MARIA SILTON PINHEIRO) ,Dança ,CE ,Eleito ,36
VERA CRISTINA SANTOS E SILVA DE ATHAYDE (Vera Cristina Santos e Silva de Athayde) ,Dança ,SP ,Habilitado ,79
VERLENE FERREIRA MESQUITA (Verlene Ferreira Mesquita) ,Dança ,AM ,Habilitado ,41
WILKINSON DO NASCIMENTO DE OLIVEIRA (Wilkinson do Nascimento de Oliveira) ,Dança ,RR ,Habilitado ,122
WSCICLEITON DE CASTRO SOUZA (Wscicleiton de Castro Souza) ,Dança ,RO ,Habilitado ,27
YACANNA RODRIGUES DOS SANTOS (Yaçannã Rodrigues dos Santos Correia) ,Dança ,AL ,Eleito ,67
ZILVANIO SOUZA DE CARVALHO (Zil Souza ) ,Dança ,AP ,Habilitado ,27
ADRIANO SANTOS (Adriano Santos) ,Design ,SC ,Eleito ,138
ALESSANDRO BRITO DIAS (Alessandro Dias) ,Design ,AM ,Eleito ,130
ANA AMELIA CAMPOS DOS ANJOS (Mel Campos) ,Design ,BA ,Eleito ,16
ANGELICA OLIVEIRA ADVERSE (angelica oliveira adverse ) ,Design ,MG ,Eleito ,52
AULIO COSTA ZAMBENEDETTI (Aulio Zambenedetti) ,Design ,PR ,Habilitado ,8
AURESNEDE PIRES STEPHAN (Auresnede Pires Stephan) ,Design ,SP ,Eleito ,122
AXEL HERMANN SANDE (Axel Sande) ,Design ,RJ ,Eleito ,23
BENTO GUSTAVO DE SOUSA PIMENTEL (Bento Gustavo Pimentel) ,Design ,PA ,Habilitado ,1
BRUNNA RICHELLY LIMA ROCHA ANCHIETA (Brunna Rocha Anchieta) ,Design ,AM ,Eleito ,357
BRUNO BELO DE LIMA (Bruno Belo de Lima) ,Design ,AL ,Eleito ,181
BRUNO CARED TAVARES (Bruno Cared) ,Design ,DF ,Habilitado ,4
CESAR HABERT PACIORNIK (Cesar Habert Paciornik) ,Design ,SP ,Eleito ,122
CLAUDIA FATIMA CAMPOS (Claudia Fátima Campos) ,Design ,MG ,Eleito ,8
CRISTIANE LOFF (Cristiane Löff) ,Design ,RS ,Habilitado ,4
CRISTIANO JOSE DE OLIVEIRA PAES DA CUNHA (Cristiano Oliveira Cunha) ,Design ,RN ,Eleito ,25
DANIEL DUTRA GOMES (Daniel Dutra) ,Design ,ES ,Habilitado ,20
DEBORA CARAMASCHI DE CAMPOS (Débora Caramaschi de Campos) ,Design ,SP ,Eleito ,71
EDUARDO LUCAS CARDOSO BRAGA (Eduardo Braga) ,Design ,MG ,Habilitado ,10
EDUARDO ROMEIRO FILHO (Eduardo Romeiro Filho) ,Design ,MG ,Habilitado ,12
ELISEU DE REZENDE SANTOS (Eliseu de Rezende Santos) ,Design ,MG ,Habilitado ,1
FABIO HENRIQUE DIAS MAXIMO (Fabio Maximo) ,Design ,AM ,Eleito ,29
FELIPE DA SILVA GOMES (FELIPE DA SILVA GOMES) ,Design ,ES ,Habilitado ,6
GERALDO MAGELA NOGUEIRA TORRES (GERALDO MAGELA NOGUEIRA TORRES) ,Design ,AP ,Eleito ,2
HARO RISTOW WIPPEL SCHULENBURG (Haro Schulenburg) ,Design ,SC ,Habilitado ,10
HAROLDO DA COSTA BRITO (Haroldo Brito) ,Design ,DF ,Eleito ,12
HENRIQUE RODRIGUES DA CUNHA (Henrique Cunha) ,Design ,SP ,Habilitado ,0
HUGO CRISTO SANT ANNA (Hugo Cristo) ,Design ,ES ,Eleito ,30
IGOR VERAS DINIZ ARAGAO (Igor Véras) ,Design ,SE ,Habilitado ,23
IRIS REGINA GOMES ANTONIO (Iris Regina Gomes Antonio) ,Design ,PE ,Eleito ,4
JANAN AMARINHO DE CARVALHO SILVA (Janan Carvalho) ,Design ,RO ,Eleito ,10
JOERCIO FONTINELLE BARBALHO JUNIOR (Joercio Fontinelle Barbalho Junior) ,Design ,PA ,Habilitado ,2
JORDANIA PEREIRA FIRMINO (Jordania Firmino) ,Design ,PB ,Eleito ,55
JOSE VICENTE AZZI GRECCO (Vicente Grecco) ,Design ,SP ,Habilitado ,0
LEONARDO ARAUJO DA COSTA (Buggy) ,Design ,CE ,Eleito ,15
LEONARDO CARDOSO EYER JORAS (Leo Eyer) ,Design ,RJ ,Eleito ,59
LETICIA DE OLIVEIRA AHOUAGI (Letícia Ahouagi) ,Design ,MG ,Habilitado ,4
LIVIA SANTANA FAUAZE (Livia Fauaze) ,Design ,BA ,Eleito ,32
LUCAS DE ALBUQUERQUE ROCHA (Lucas de Albuquerque Rocha) ,Design ,SP ,Habilitado ,0
LUIZ FERNANDEZ DE MOURA E PITA (Luiz Fernandez de Moura e Pita) ,Design ,MT ,Eleito ,2
MANUEL TELES DE OLIVEIRA FILHO (Manuel Teles ) ,Design ,PI ,Eleito ,10
MARCIO ALVES DA ROCHA (Marcio Alves da Rocha) ,Design ,GO ,Habilitado ,22
MARCIO CHAVES LAVOR (Márcio Chaves Lavôr) ,Design ,RR ,Eleito ,1
MARILIA ISFER RAVVANELLO (Marilia Isfer Ravanello) ,Design ,PR ,Eleito ,9
MAURO ERLEI SCHNEIDER MARTIN (Mauro Erlei Schneider Martin) ,Design ,RS ,Habilitado ,3
MAX REUS MONTIEL SEVERO (Max Reus Montiel Severo) ,Design ,RS ,Inabilitado ,3
MAYARA FELICIANO (Mayara Feliciano) ,Design ,SC ,Eleito ,1
PAULO PERDOMO RODRIGUES (Paulo Perdomo Rodrigues ) ,Design ,RS ,Eleito ,8
PEDRO BRAGA LEITAO (Pedro Braga Leitão) ,Design ,RJ ,Eleito ,49
PEDRO FELIPE BEZERRA DA SILVA (Pedro Felipe) ,Design ,PE ,Habilitado ,3
POLLIANA GUIMARAES LOPES (Polli Di Castro) ,Design ,GO ,Habilitado ,1
RAFFAEL REGIS DE ARAUJO (Raffael Regis) ,Design ,PA ,Habilitado ,0
RAQUEL GOMES NORONHA (Raquel Noronha) ,Design ,MA ,Eleito ,17
RENATO ANTONIO BERTAO (Re-nato Antonio Bertão) ,Design ,PR ,Habilitado ,4
RENATO DE PAULA MESQUITA (Renato de Paula Mesquita) ,Design ,GO ,Eleito ,82
RENATO PONTUAL DE SOUZA FREITAS (Renato Pontual) ,Design ,DF ,Habilitado ,7
RHALDNEY FERREIRA DE LIMA (Rhaldney Lima) ,Design ,PE ,Inabilitado ,1
RODRIGO ZEN (Rodrigo Zen) ,Design ,SC ,Habilitado ,42
SAMIA BATISTA E SILVA (Sâmia Batista e Silva) ,Design ,PA ,Eleito ,13
SEBASTIAO FILHO DE OLIVEIRA POSSA (Sebastião Filho de Oliveira Possa) ,Design ,AP ,Eleito ,39
SILVIA CRISTINA GRILLI SILVA (SILVIA GRILLI) ,Design ,SP ,Habilitado ,11
TALES BUNDCHEN ZACCARO DE OLIVEIRA (TALES BUNDCHEN ZACCARO DE OLIVEIRA) ,Design ,SE ,Eleito ,94
THALES ALBANO DE SOUSA PIMENTA (Thales Albano de Sousa Pimenta) ,Design ,MS ,Habilitado ,0
TIAGO BRUNO TORRES DE JESUS (Tiago Torre) ,Design ,BA ,Eleito ,26
WILLY MIRANDA SILVA (Nego Jamaica (Willy Miranda)) ,Design ,AP ,Eleito ,64
AFRISIO ACACIO (Afrisio Acacio) ,"Literatura, Livro e Leitura ",AL ,Inabilitado ,84
AGNALDO DOS SANTOS HOLANDA LOPES (Agnaldo Holanda) ,"Literatura, Livro e Leitura ",MS ,Habilitado ,1
AIRTON SOUZA DE OLIVEIRA (AIRTON SOUZA DE OLIVEIRA) ,"Literatura, Livro e Leitura ",PA ,Habilitado ,66
ALDENOR DA SILVA PIMENTEL (Aldenor Pimentel) ,"Literatura, Livro e Leitura ",RR ,Eleito ,32
ALEX WAGNER DIAS (ALEX WAGNER DIAS) ,"Literatura, Livro e Leitura ",SP ,Habilitado ,27
ALUFA LICUTA K Q Z G SOARES (alufa-licuta kibo quilimandjaro oxoronga ) ,"Literatura, Livro e Leitura ",PE ,Habilitado ,18
ALUISIO AZEVEDO JUNIOR (Aluísio Azevedo Júnior) ,"Literatura, Livro e Leitura ",RN ,Habilitado ,24
ANA CRISTINA CARONI AVEROLDI (Ana Cristina Caroni Averoldi) ,"Literatura, Livro e Leitura ",SP ,Habilitado ,2
ANDRE PERES DE LIMA (ANDRE PERES DE LIMA) ,"Literatura, Livro e Leitura ",SP ,Habilitado ,59
ANDRESA PEREIRA SERPEJANTE (Andresa Pereira Serpejante) ,"Literatura, Livro e Leitura ",PR ,Habilitado ,14
ANGELI ROSE DO NASCIMENTO (ANGELI ROSE ) ,"Literatura, Livro e Leitura ",RJ ,Habilitado ,0
ANTONIO DA CONCEICAO FERREIRA (Antonio da Conceição Ferreira) ,"Literatura, Livro e Leitura ",DF ,Habilitado ,3
ANTONIO OLIVEIRA SANTOS (Antonio Oliveira Santos) ,"Literatura, Livro e Leitura ",BA ,Habilitado ,81
ANTONIO PEDRO MARTINS VIANNA NETO (Pedro Vianna) ,"Literatura, Livro e Leitura ",PA ,Habilitado ,24
BARBARA VIEIRA NOVA (Bárbara Vieira Nova) ,"Literatura, Livro e Leitura ",SP ,Inabilitado ,0
BENEDITO LOPES LIMA (Benedito Lopes Lima) ,"Literatura, Livro e Leitura ",DF ,Habilitado ,2
BRUNO RAFAEL DE ALBUQUERQUE GAUDENCIO (Bruno Rafael de Albuquerque Gaudêncio) ,"Literatura, Livro e Leitura ",PB ,Habilitado ,28
CAMILA SCHOFFEN TRESSINO (Camila Schoffen Tressino) ,"Literatura, Livro e Leitura ",RS ,Eleito ,139
CARLOS ALBERTO SANTOS LIMA FILHO (Alberto Lima) ,"Literatura, Livro e Leitura ",BA ,Habilitado ,14
CARLOS ANTONIO PARA BARBOSA DA SILVA (Carlos Pará) ,"Literatura, Livro e Leitura ",PA ,Habilitado ,42
CARLOS MAURO DA ROCHA (Carlos Mauro da Rocha) ,"Literatura, Livro e Leitura ",DF ,Inabilitado ,1
CARLOS ROBERTO NOGUEIRA DE VASCONCELOS (Carlos Roberto Nogueira de Vasconcelos ) ,"Literatura, Livro e Leitura ",CE ,Habilitado ,35
CARLOS WELLINGTON SOARES MARTINS (Carlos Wellington Soares Martins) ,"Literatura, Livro e Leitura ",MA ,Habilitado ,134
CATIA TOLEDO MENDONCA (Catia Toledo Mendonça) ,"Literatura, Livro e Leitura ",PR ,Eleito ,25
CHRISTINE BAENA CASTILHO FONTELLES (Christine Castilho Fontelles) ,"Literatura, Livro e Leitura ",SP ,Habilitado ,20
CLARIMUNDO AMADO GONCALVES ROHRIG (Clarimundo Röhrig ) ,"Literatura, Livro e Leitura ",RS ,Habilitado ,52
CLAUDIO CARDOSO DE ANDRADE COSTA (CLÁUDIO CARDOSO DE ANDRADE COSTA) ,"Literatura, Livro e Leitura ",PA ,Habilitado ,1
CLAUDIO JOSE AVILA ROCHA (Claudio Rocha) ,"Literatura, Livro e Leitura ",MG ,Inabilitado ,36
CLEIDE CRISTINA SOARES (Cleide Soares) ,"Literatura, Livro e Leitura ",DF ,Eleito ,59
CLEOMARINA GUIMARAES DA SILVA SANTOS (cleomarina guimaraes da silva) ,"Literatura, Livro e Leitura ",RO ,Inabilitado ,3
CRISTIANE GRANDO (Cristiane Grando) ,"Literatura, Livro e Leitura ",SP ,Habilitado ,47
DAMIANA MARIA BARBOSA JAIRES MELO (Damiana Maria Barbosa Jaires Melo) ,"Literatura, Livro e Leitura ",AL ,Eleito ,9
DANIELE RODRIGUES DA COSTA (Dani Mirini ) ,"Literatura, Livro e Leitura ",AC ,Eleito ,8
DANIELLI RODRIGUES (Danielli Rodrigues) ,"Literatura, Livro e Leitura ",PR ,Habilitado ,11
DEIVISSON LOPES PIMENTEL (Deivisson Lopes) ,"Literatura, Livro e Leitura ",BA ,Habilitado ,3
DENIZETE LIMA DE MESQUITA (Denizete Mesquita) ,"Literatura, Livro e Leitura ",PI ,Habilitado ,5
DENNIA DE SOUSA ALMEIDA FERREIRA (Dennia de Sousa Almeida Ferreira) ,"Literatura, Livro e Leitura ",GO ,Habilitado ,28
DEVISON AMORIM DO NASCIMENTO (Devison Amorim do Nascimento) ,"Literatura, Livro e Leitura ",PA ,Eleito ,220
DJALDA MARACIRA CASTELO BRANCO MUNIZ (Djalda Maracira Castelo Branco Muniz) ,"Literatura, Livro e Leitura ",MA ,Eleito ,345
DOMINGOS CONCEICAO (Domingos Conceição Negrinho do Pará) ,"Literatura, Livro e Leitura ",PA ,Eleito ,229
EDNEI PROCOPIO DOS SANTOS (Ednei Procopio ) ,"Literatura, Livro e Leitura ",SP ,Habilitado ,3
ELIANA GOMES DA SILVA (Eliana Gomes da Silva ) ,"Literatura, Livro e Leitura ",SP ,Inabilitado ,3
ELIANY ALVARENGA DE ARAUJO (Eliany Alvarenga de Araújo) ,"Literatura, Livro e Leitura ",GO ,Habilitado ,45
ELISA CAMPOS MACHADO (Elisa Campos Machado) ,"Literatura, Livro e Leitura ",RJ ,Eleito ,61
ELIZABETH CHRISTINA DE SOUZA CAMPOS (Elizabeth Christina de Souza Campos) ,"Literatura, Livro e Leitura ",MG ,Habilitado ,13
ERNANDES DANTAS E SILVA (Ernandes Dantas e Silva) ,"Literatura, Livro e Leitura ",RR ,Eleito ,225
EUGENIO MARIA GOMES (Eugênio Maria Gomes) ,"Literatura, Livro e Leitura ",MG ,Habilitado ,19
FABIO ARAUJO OLIVEIRA (Fábio Oliveira) ,"Literatura, Livro e Leitura ",BA ,Habilitado ,1
FABIO BERNARDO FURTADO (FABIO BERNARDO FURTADO) ,"Literatura, Livro e Leitura ",AP ,Eleito ,71
FLOR DE MARIA DA COSTA FONTELLES (FLOR DI MARIA FONTELLES) ,"Literatura, Livro e Leitura ",PA ,Habilitado ,1
FRANCIMARA SALVADOR (Mara Coradello) ,"Literatura, Livro e Leitura ",ES ,Eleito ,4
FRANCISCO ALVES FIGUEIREDO (francisco alves figueiredo) ,"Literatura, Livro e Leitura ",AC ,Habilitado ,19
FRANCISCO DAS CHAGAS SILVA (Francisco das Chagas Silva) ,"Literatura, Livro e Leitura ",RO ,Eleito ,43
