Candidato,Setorial,Estado,Situação,Votos
GUILHERME ANTONIO DOS SANTOS (GUILHERME ANTONIO DOS SANTOS) ,Artesanato ,TO ,Habilitado ,4
HILDA MICHALCZESZEN CORREIA (hilda michalczeszen correia) ,Artesanato ,PR ,Habilitado ,7
HILDA MONTEIRO DE AZEVEDO (Hilda Azevedo) ,Artesanato ,RO ,Habilitado ,5
IRINEU BENTO (Irineu Bento) ,Artesanato ,SC ,Eleito ,142
ISABELA NOGUEIRA TELES (Isabela Nogueira Teles) ,Artesanato ,SE ,Habilitado ,2
ISAQUIEL JOSE DE FRANCA (Isaquel José de França) ,Artesanato ,PB ,Habilitado ,13
IZABEL GONCALVES BEZERRA (Isabel Gonçalves Bezerra ) ,Artesanato ,PE ,Eleito ,242
JAIR DIONISIO DE SOUZA (RHAAVI DIONISIO) ,Artesanato ,SP ,Habilitado ,1
JANE CLARA ARGUELLO MARTINS DIAS (JANE CLARA ARGUELLO MARTINS DIAS ) ,Artesanato ,MS ,Habilitado ,54
JOANA MARTA CHAVES PIMENTEL (Joana Marta Chaves Pimentel) ,Artesanato ,RR ,Eleito ,16
JOAO BERNARDO AMAZONAS FILHO (JOÃO BERNARDO AMAZONAS FILHO) ,Artesanato ,RR ,Inabilitado ,2
JOAO ROBERTO DE SOUZA SILVA (João Roberto S. Silva - Jotaerre) ,Artesanato ,MG ,Habilitado ,34
JORGE ROBERTO DA SILVA WANDERLEY (Jorge Roberto da Silva Wanderley) ,Artesanato ,GO ,Habilitado ,10
JOSE AMAURY MACHADO CAMIZAO (Amaury Camizão Juruna) ,Artesanato ,PA ,Habilitado ,7
JOSE GERALDO DOS SANTOS (José Geraldo dos Santos) ,Artesanato ,SP ,Inabilitado ,5
JOSE LUIZ DOS PASSOS (JOSE LUIZ DOS PASSOS) ,Artesanato ,SE ,Inabilitado ,9
JOSEANE MAYARA LEITE LEAL (Joseane Mayara Leite Leal) ,Artesanato ,RN ,Habilitado ,2
JOSEFA MORAES VALERIANO (Josefa Moraes Valeriano) ,Artesanato ,AL ,Eleito ,75
JOSSIMARA DE SOUZA DE LIMA (Jossimara Lima) ,Artesanato ,PR ,Habilitado ,8
JUCARA TEREZA MOES DA SILVA (JUÇARA TEREZA MÕES DA SILVA) ,Artesanato ,RJ ,Eleito ,85
JULIETA DE LOURDES ESTEVAO LOPES (Julieta de Lourdes Estevão Lopes) ,Artesanato ,PB ,Eleito ,22
KAHDYNN MENDES DE MELO (Ked mendes) ,Artesanato ,RN ,Habilitado ,35
KARINE GOMES QUEIROZ (Karine Queiroz) ,Artesanato ,PR ,Habilitado ,2
KEIKO ROSANA DE SOUZA SATO (Keiko Sato) ,Artesanato ,PR ,Habilitado ,18
LEON LOPES DA SILVA (Leon Lopes da Silva) ,Artesanato ,RN ,Inabilitado ,2
LIGIA MARIA DA SILVA BORGES (Ligia Maria da Silva Borges) ,Artesanato ,SE ,Eleito ,44
LOLIANE DAVID COLPAS (Loli Colpa ) ,Artesanato ,SP ,Habilitado ,10
LUCIA DE FATIMA VALERIO DA SILVA CRUZ (Lucia Cruz) ,Artesanato ,DF ,Eleito ,66
LUIZ RENATO SOARES MAGALHAES (Renato Magalhães) ,Artesanato ,RJ ,Inabilitado ,18
MARCIA MARIA DE OLIVEIRA (Marcia Maria de Oliveira) ,Artesanato ,RN ,Eleito ,56
MARCIA MORALES SALIS (Marcia Morales) ,Artesanato ,RS ,Eleito ,109
MARCO ANTONIO DARKIEWICZ (Marco Antonio Darkiewicz) ,Artesanato ,RS ,Eleito ,127
MARIA ANTONIA OLIVEIRA CHAQUIAN (Maria Antônia Oliveira Chaquian) ,Artesanato ,RO ,Habilitado ,3
MARIA BONFIM MOREIRA DE SOUZA (Maria Bonfim Moreira de Souza) ,Artesanato ,TO ,Eleito ,11
MARIA DAS GRACAS PEREIRA CRUZ OBRIGON (marias das graças pereira cruz obrigon) ,Artesanato ,RO ,Habilitado ,1
MARIA DE FATIMA ALCANTARA DE SOUZA (Maria de Fátima Alcântara de Souza) ,Artesanato ,RN ,Habilitado ,6
MARIA DO LIVRAMENTO DE AGUIAR (MARIA DO LIVRAMENTO DE AGUIAR) ,Artesanato ,PE ,Habilitado ,61
MARIA GORETH DE MEDEIROS (Maria Goreth de Medeiros) ,Artesanato ,RN ,Habilitado ,5
MARILEA DA CRUZ (MARILÉA DA CRUZ) ,Artesanato ,RJ ,Habilitado ,4
MARINA PRUDENTE DE TOLEDO (Marina Prudente de Toledo) ,Artesanato ,SP ,Eleito ,93
MARIO KICHESE NETO (MARIO KICHESE NETO) ,Artesanato ,GO ,Habilitado ,61
MARLI GONCALVES RIOS (Marli Gonçalves Rios) ,Artesanato ,GO ,Eleito ,394
MILTON BATISTA DE SOUZA JUNIOR (Milton Batista de Souza Junior) ,Artesanato ,AL ,Habilitado ,64
NILSON TEIXEIRA SILVA JUNIOR (nilson teixeira silva junior) ,Artesanato ,TO ,Habilitado ,4
OTHILIA BAPTISTA MELO DE SAMPAIO (Othilia Baptista Melo de Sampaio) ,Artesanato ,AC ,Habilitado ,4
PAULO CARDOSO (Paulo Cardoso) ,Artesanato ,SC ,Habilitado ,12
RAIMUNDO MAGNO CARDOSO NASCIMENTO (Raimundo Magno Cardoso Nascimento) ,Artesanato ,PA ,Eleito ,49
RENATO SAMPAIO DA SILVA (Renato Sampaio da Silva) ,Artesanato ,PA ,Eleito ,342
RICARDO PEREIRA LIMA (Ricardo Lima) ,Artesanato ,SP ,Habilitado ,10
RISOLANGE RODRIGUES DA SILVA (RISOLANGE RODRIGUES DA SILVA) ,Artesanato ,PE ,Habilitado ,1
RITA MARIA DOS SANTOS DA SILVA MATOS (RITA MARIA DOS SANTOS DA SILVA MATOS) ,Artesanato ,BA ,Eleito ,2
ROMILCE RODRIGUES SILVA (Romilce Rodrigues Silva) ,Artesanato ,BA ,Inabilitado ,2
RONALDO OMAR MARTINS DUTRA (Ronaldo Omar Martins Dutra) ,Artesanato ,ES ,Eleito ,7
ROZELIA DOS SANTOS SILVA MENDES (Rozelia dos Santos Silva Mendes) ,Artesanato ,DF ,Eleito ,54
SAMIRA KELLY DA SILVA TORRES (Samira Kelly da Silva Torres) ,Artesanato ,AL ,Habilitado ,11
SIDNEIA BARBOSA DA SILVA (sidneia barbosa) ,Artesanato ,RN ,Habilitado ,17
SILVANA DE ALMEIDA SILVA (SILVANA DE ALMEIDA SILVA) ,Artesanato ,AM ,Eleito ,1
SILVANA PACHECO NUNES (silvana pacheco nunes) ,Artesanato ,RN ,Eleito ,91
SIMEI ARANHA DANTAS (Simei Aranha Dantas) ,Artesanato ,MA ,Eleito ,185
SONIA CRISTINA DE ALBUQUERQUE NARCISO (Sonia Cristina de Albuquerque Narciso) ,Artesanato ,MS ,Eleito ,56
SUSICLEIDE CARDOSO DE AGUIAR (susicleide cardoso de aguiar) ,Artesanato ,SP ,Habilitado ,15
TERESINHA DE JESUS SILVEIRA (Teresinha de Jesus Silveira) ,Artesanato ,SC ,Inabilitado ,3
VANILDA MARIA NASCIMENTO DOS SANTOS (Vanilda Nascimento) ,Artesanato ,AL ,Habilitado ,50
VERA LUCIA CARVALHO DE LIMA (VERA LÚCIA CARVALHO DE LIMA) ,Artesanato ,AP ,Eleito ,56
VILMAR OLIVEIRA DE JESUS (Vilmar Oliveira de Jesus) ,Artesanato ,MG ,Eleito ,169
ADELLY VINHAES COSTANTINI (Adelly Vinhaes Costantini) ,Circo ,RJ ,Eleito ,17
ALICE SOARES DE ARAUJO (Alice Araújo) ,Circo ,AP ,Eleito ,69
ANDRE DA COSTA RODRIGUES (André Costa) ,Circo ,MG ,Eleito ,132
CARLOS AMERICO NERI SERRA (CARLITUS SERRA) ,Circo ,TO ,Eleito ,17
CARLOS ARRUDA ANUNCIATO (Carlos Anunciato ) ,Circo ,MS ,Habilitado ,9
CARLOS AUGUSTO PEIXOTO (Carlos Augusto Peixoto) ,Circo ,ES ,Eleito ,12
CARLOS EDUARDO DE OLIVEIRA JUNIOR (Kadu Oliviê) ,Circo ,TO ,Habilitado ,10
CESAR APARECIDO RIBEIRO GUIMARAES (CESAR APARECIDO GUIMARAES) ,Circo ,SP ,Habilitado ,2
CRISTINA VILLAR DE SOUZA (Cristina Villar de Souza) ,Circo ,SC ,Eleito ,35
DONNY WALLESSON DOS SANTOS (Donny Wallesson dos Santos) ,Circo ,MA ,Eleito ,48
EBER MARCELO BUNDCHEN (Eber Marcelo Bundchen) ,Circo ,SC ,Habilitado ,2
ERIC DIAS DOS SANTOS (Palhaço Fedegoso) ,Circo ,MG ,Habilitado ,4
ERIC VINICIUS GARCIA ALMEIDA PIRES (ERIC VINICIUS GARCIA ALMEIDA PIRES) ,Circo ,CE ,Eleito ,13
ERIVANIO DE MELO TELES (Erivanio de Melo Teles) ,Circo ,AL ,Eleito ,31
FABRICIO BOHRER DORNELES (Fabricio Dorneles) ,Circo ,RJ ,Eleito ,20
FELIPE THIAGO TEIXEIRA DA SILVA (Felipe Thiago Teixeira da Silva) ,Circo ,RJ ,Habilitado ,7
FERNANDO SILVA DE ASSUNCAO (Taz Assunção) ,Circo ,SP ,Eleito ,15
FRANCIELLE GONCALVES GOMES (Francielle Gonçalves Gomes) ,Circo ,PR ,Habilitado ,1
FRANCISCO GRIGORIO DA SILVA (Francisco Grigório da Silva) ,Circo ,RO ,Inabilitado ,17
GEOVANE ROGER ALVES DO NASCIMENTO (Geovane Roger Alves do Nascimento) ,Circo ,AC ,Eleito ,6
ISRAEL STALLIN FERREIRA DINIZ (Israel Stallin Palhaço Siriguela) ,Circo ,GO ,Eleito ,18
JEFFERSON DORNELAS JACINTO (Jefferson Dornelas Jacinto) ,Circo ,AM ,Eleito ,20
JOAO BATISTA FELIX DA SILVA (João Batista Felix da Silva (Palhaço Xuxu de RR)) ,Circo ,RR ,Eleito ,115
JONES BARBOSA DE SOUZA (Jones Barsou) ,Circo ,AP ,Eleito ,29
JOSE CLEMENTINO DE OLIVEIRA (Zezo Oliveira) ,Circo ,PE ,Eleito ,29
JOSE MARIA MARIANO (José Maria Mariano ) ,Circo ,MG ,Habilitado ,44
JUAREZ GOMES DE OLIVEIRA JUNIOR (Junior De Oliveira) ,Circo ,MS ,Habilitado ,6
JULIA CAIANARA DANTAS VIEIRA (Julia Caianara Dantas Vieira) ,Circo ,SE ,Eleito ,2
JULIO CESAR FREITAS COELHO (Julio Cesar Freitas Coelho) ,Circo ,MT ,Eleito ,8
KARINA CRISTINA AIRES PEREIRA LIMA (Karina Cristina Ares Pereira Lima) ,Circo ,PA ,Habilitado ,3
LAILA SAAD PULCHERIO (LAILA SAAD PULCHÉRIO) ,Circo ,MS ,Eleito ,31
LEONILDO DE ASSIS SILVA (Leonildo de Assis Silva) ,Circo ,RR ,Habilitado ,2
LUCIANO ROBERTO DO NASCIMENTO (Luciano Roberto do Nascimento) ,Circo ,RN ,Eleito ,34
LUIZ DA COSTA NEPOMUCENO FILHO (Luiz Nepomuceno) ,Circo ,RN ,Habilitado ,15
MARIA UIARA DE SANTANA (Maria Uiara de Santana) ,Circo ,CE ,Habilitado ,1
MICHELLE MOCELLIN DE ALMEIDA (Michelle Mocellin de Almeida) ,Circo ,DF ,Eleito ,9
NIELSON RODRIGO BARROS (Rodrigo Ethnos) ,Circo ,PA ,Eleito ,18
OSANA LOPES DOS SANTOS BORGES (OSANA LOPES DOS SANTOS BORGES ) ,Circo ,PA ,Eleito ,29
RAMON EDUARDO MOREIRA MARAMBIO (Ramon Eduardo Moreira Marambio) ,Circo ,SP ,Habilitado ,11
RENATA MARQUES PEREIRA (Renata Marques Pereira Ruiz) ,Circo ,RN ,Eleito ,23
RITA DE CASSIA ANDRE MASINI (Rita Masini) ,Circo ,RS ,Habilitado ,13
RUBENS GARCIA DE FARIAS (Rubens Garcia DeFarias) ,Circo ,BA ,Habilitado ,2
SANDERSON SILVA CANJO (Sanderson Silva Canjo) ,Circo ,RR ,Habilitado ,5
SANDRO DA SILVA BRITO (Sandro da Silva Brito) ,Circo ,AP ,Eleito ,24
SERGIO AUGUSTO CORREIA GONCALVES DE OLIVEIRA (Sérgio Oliveira) ,Circo ,PR ,Eleito ,2
SERGIO ROGERIO CESARIO COSTA (Sérgio Costa) ,Circo ,SP ,Inabilitado ,4
SILVIA MARA ABREU (Silvia Mara Abreu) ,Circo ,RS ,Eleito ,16
TATIANA SANTOS ROCHA DE SOUZA (Tatiana Rocha) ,Circo ,AL ,Eleito ,33
VALMIR ANTONIO DE SOUSA CASTRO (valmir antonio de sousa castro) ,Circo ,PI ,Eleito ,1
VIVIANE ABREU PEDREIRA DE OLIVEIRA (Viviane Abreu) ,Circo ,BA ,Eleito ,20
WILMA MACEDO SILVA (Wilma Macedo Silva) ,Circo ,BA ,Eleito ,35
ADAELSON SOUZA DOS SANTOS (Adaelson Souza dos Santos) ,Culturas Afro-Brasileiras ,PA ,Inabilitado ,1
ADEGMAR JOSE DA SILVA (Adegmar José da Silva) ,Culturas Afro-Brasileiras ,PR ,Eleito ,21
ADERBAL MOREIRA COSTA (Aderbal Moreira Costa ( Aderbal Ashogun)) ,Culturas Afro-Brasileiras ,RJ ,Habilitado ,11
ADRIANO BATISTA CASTORINO (Adriano Castorino) ,Culturas Afro-Brasileiras ,TO ,Eleito ,11
ALCIDES TONY DA SILVA (ALCIDES TONY DA SILVA) ,Culturas Afro-Brasileiras ,PI ,Habilitado ,0
ALEXANDRE DA SILVA PONTES (Alexandre da Silva Pontes) ,Culturas Afro-Brasileiras ,DF ,Habilitado ,25
ALEXANDRE SILVEIRA DE SOUZA (Alexandre Silveira de Souza) ,Culturas Afro-Brasileiras ,DF ,Habilitado ,50
ALEXANDRE TEIXEIRA MARQUES (Alexandre Teixeira Marques) ,Culturas Afro-Brasileiras ,DF ,Habilitado ,1
ALVARO JOSE DOS SANTOS SOUZA (Neto de Nanã) ,Culturas Afro-Brasileiras ,MA ,Eleito ,254
ANDERSON MELLO DE PAULA (Anderson Mello de Paula) ,Culturas Afro-Brasileiras ,RJ ,Habilitado ,25
ANDERSON ROMANHA DE SOUZA (ANDERSON) ,Culturas Afro-Brasileiras ,ES ,Inabilitado ,3
ANGELA MARIA DOS SANTOS (Ângela Maria dos Santos) ,Culturas Afro-Brasileiras ,MT ,Habilitado ,3
ANTONIA LUCIA NASCIMENTO HOLLES (Antonia Quilombola Nascimento) ,Culturas Afro-Brasileiras ,PA ,Habilitado ,17
ANTONIO SEBASTIAO FRANCO DA SILVA (Antonio Franco) ,Culturas Afro-Brasileiras ,SP ,Inabilitado ,0
ARLENE MARIA CAMARGO (Arlene de Katendê) ,Culturas Afro-Brasileiras ,RJ ,Habilitado ,1
BIANCA CRISTINA ALENCAR DE AZEVEDO (Bianca Cristina Alencar de Azevedo) ,Culturas Afro-Brasileiras ,AM ,Eleito ,18
CARLA MARA HENRIQUE SILVA (Carla Mara Henrique Silva) ,Culturas Afro-Brasileiras ,CE ,Habilitado ,105
CARLOS EDUARDO MALAQUIAS TOMAZ (Carlos Eduardo Malaquias Tomaz) ,Culturas Afro-Brasileiras ,PR ,Habilitado ,16
CASSIA CRISTINA DA SILVA (Cassia Cristina da Silva- Makota Kidoiale) ,Culturas Afro-Brasileiras ,MG ,Eleito ,57
CELITO RODRIGUES DARIVA (celito rodrigues dariva) ,Culturas Afro-Brasileiras ,PR ,Habilitado ,17
CLAUDIA CRISTINA REZENDE PUENTES (Cláudia Cristina Rezende Puentes) ,Culturas Afro-Brasileiras ,AL ,Inabilitado ,126
CLAUDIA MARIA DE OLIVEIRA DE SOUZA (IYALORIXÁ CLAUDIA DE OYA) ,Culturas Afro-Brasileiras ,SP ,Habilitado ,32
DANIEL DO NASCIMENTO LOPES (DANIEL DO NASCIMENTO LOPES) ,Culturas Afro-Brasileiras ,AC ,Eleito ,11
DEBORA CARDIAL DE MIRANDA (EKEDE DEBORA) ,Culturas Afro-Brasileiras ,RJ ,Habilitado ,38
DENISE MARIA BOTELHO (Denise Maria Botelho) ,Culturas Afro-Brasileiras ,PE ,Eleito ,52
DEUZILENE REIS (Deuzilene Reis) ,Culturas Afro-Brasileiras ,MA ,Habilitado ,149
DILMAIR MONTE DOS SANTOS (DILMAIR MONTE DOS SANTOS) ,Culturas Afro-Brasileiras ,RS ,Habilitado ,9
EDMAR BARBOSA BONFIM (Mãe Tuca d'Osoguiã) ,Culturas Afro-Brasileiras ,PB ,Eleito ,80
EDNEIA SOUSA RODRIGUES (edneia sousa rodrigues) ,Culturas Afro-Brasileiras ,BA ,Inabilitado ,27
EDUARDO PARREIRA DA SILVA (EDUARDO PARREIRA DA SILVA) ,Culturas Afro-Brasileiras ,RJ ,Habilitado ,20
ELIANDRA REGINA SOLEIRA (Ekeji Eliandra) ,Culturas Afro-Brasileiras ,SP ,Habilitado ,21
ESDRAS RODRIGUES GURGEL (Esdras Rodrigues Gurgel) ,Culturas Afro-Brasileiras ,RN ,Habilitado ,27
ESTEFANY CRISTINE DE MOURA DOS PASSOS (Estefany Cristine de Moura dos Passos) ,Culturas Afro-Brasileiras ,SC ,Inabilitado ,2
EXPEDITO PAULA NEVES (Expedito Pala Neves (Dito D'osòósi)) ,Culturas Afro-Brasileiras ,PE ,Habilitado ,30
EZEQUIEL DE SOUZA (Ezequiel de Souza) ,Culturas Afro-Brasileiras ,AM ,Inabilitado ,3
FELIPE RODRIGUES MARTINS (Felipe Kọfàmilẹ́wà) ,Culturas Afro-Brasileiras ,PA ,Habilitado ,14
FERNANDO AMBROSI (Fernando de Olodê) ,Culturas Afro-Brasileiras ,GO ,Habilitado ,23
FERNANDO LEMOS BAENA (Fernando Lemos Baena) ,Culturas Afro-Brasileiras ,AP ,Habilitado ,9
FERNANDO LUIS DIAS VARELLA (Fernando Luís Dias Varella) ,Culturas Afro-Brasileiras ,RN ,Habilitado ,4
FLAVIO HONORIO DA COSTA (Flavio Costa ) ,Culturas Afro-Brasileiras ,RJ ,Habilitado ,34
FRANCINETE SANTOS BRAGA (FRANCINETE BRAGA) ,Culturas Afro-Brasileiras ,MA ,Eleito ,398
GEOVA ALVES DA SILVA (Geová Alves da Silva) ,Culturas Afro-Brasileiras ,ES ,Eleito ,310
GILBERTO MANOEL SOARES (GILBERTO MANOEL SOARES) ,Culturas Afro-Brasileiras ,RS ,Habilitado ,45
GILVANE SILVA DE MAGALHAES (GILVANE SILVA DE MAGALHAES) ,Culturas Afro-Brasileiras ,PA ,Habilitado ,6
GILVANO DA SILVA QUADROS (GILVANO DA SILVA QUADROS) ,Culturas Afro-Brasileiras ,PI ,Habilitado ,30
GUILHERME GIUSEPPIN TORRES (GUILHERME GIUSEPPIN) ,Culturas Afro-Brasileiras ,SP ,Inabilitado ,1
HAMILTON RICHARD ALEXANDRINO FERREIRA DOS SANTOS (Big Richard) ,Culturas Afro-Brasileiras ,DF ,Habilitado ,54
HENDRIX ALESSANDRO ANZORENA SILVEIRA (Bàbá Hendrix ) ,Culturas Afro-Brasileiras ,RS ,Habilitado ,61
HILDIMA RAMOS DA SILVA (HILDIMA RAMOS DA SILVA) ,Culturas Afro-Brasileiras ,AP ,Eleito ,52
INGRID GOMES DA SILVA (INGRID GOMES ) ,Culturas Afro-Brasileiras ,PI ,Eleito ,166
IRIVAN DE ASSIS SANTOS SILVA (IRIVAN DE ASSIS SANTOS SILVA) ,Culturas Afro-Brasileiras ,SE ,Habilitado ,29
ISABEL CRISTINA ALVES RODRIGUES DOS SANTOS (Mãe Isabel) ,Culturas Afro-Brasileiras ,SP ,Habilitado ,18
ISRAEL ANTONIO EVANGELISTA DOS SANTOS (OFARERE ISRAEL EVANGELISTA) ,Culturas Afro-Brasileiras ,RJ ,Habilitado ,4
IURY LORRAN SILVA DA SOLEDADE (IURY LORRAN SILVA DA SOLEDADE) ,Culturas Afro-Brasileiras ,AP ,Habilitado ,117
IVANIR PEREIRA GUIMARAES (Pituka Nirobe) ,Culturas Afro-Brasileiras ,RJ ,Eleito ,51
IVONETE DA SILVA (Mãe Ivonete Silva - Maiambemim) ,Culturas Afro-Brasileiras ,PB ,Habilitado ,15
JACKELINE MARIA DA SILVA (JACKELINE MARIA DA SILVA) ,Culturas Afro-Brasileiras ,MT ,Eleito ,4
JEAN AGUIAR DE ALMEIDA (JEAN AGUIAR DE ALMEIDA) ,Culturas Afro-Brasileiras ,SP ,Habilitado ,0
JEFERSON VIRMONDES DA COSTA (Pai Jeferson D´Ogum) ,Culturas Afro-Brasileiras ,SP ,Habilitado ,27
JOAO BOSCO SOUSA DA SILVA (João Bosco Sousa da Silva) ,Culturas Afro-Brasileiras ,AM ,Habilitado ,4
JOAO CARLOS AGOSTINHO PRUDENCIO (Mestre Griô Prudêncio) ,Culturas Afro-Brasileiras ,RS ,Habilitado ,30
JOEL DARCI DA SILVA (joel darci da silva) ,Culturas Afro-Brasileiras ,PR ,Habilitado ,1
JOEL MARIANO BORGES (Joel Mariano Borges) ,Culturas Afro-Brasileiras ,DF ,Habilitado ,119
JOSE LUIZ CABREIRA RODRIGUES (BABALORIXA JOSE DO XANGO PRINCIPE DO OYO) ,Culturas Afro-Brasileiras ,RS ,Habilitado ,26
JOSE ROBERTO BARBOSA (José Roberto Barbosa) ,Culturas Afro-Brasileiras ,SP ,Habilitado ,9
JOSIMAR DA ROCHA FERNANDES (josimar rocha FERNANDES) ,Culturas Afro-Brasileiras ,RN ,Eleito ,44
KATIA ANDRADE DE HADAD (Katia Hadad) ,Culturas Afro-Brasileiras ,PA ,Eleito ,275
KATIA DOS SANTOS PENHA (Katia santos Penha ) ,Culturas Afro-Brasileiras ,ES ,Habilitado ,3
LAMARTINE JOSE DOS SANTOS (Lamartine José dos Santos) ,Culturas Afro-Brasileiras ,MS ,Eleito ,213
LILIAN STHEFAINE AMARAL DE SOUZA (Kinancimê ) ,Culturas Afro-Brasileiras ,RR ,Habilitado ,26
LUCIA DE FATIMA BATISTA DE OLIVEIRA (MÃE LÚCIA OMIDEWÁ) ,Culturas Afro-Brasileiras ,PB ,Habilitado ,2
LUCIANO ALVES CALAZANS (Luciano Alves Calazans ) ,Culturas Afro-Brasileiras ,DF ,Habilitado ,52
LUIZ ALBERTO DA SILVA LIMA (Luiz Alberto da Silva Lima) ,Culturas Afro-Brasileiras ,AP ,Habilitado ,48
LUIZ CARLOS RODRIGUES DA SILVA (Luiz Carlos Rodrigues da Silva) ,Culturas Afro-Brasileiras ,MA ,Habilitado ,49
LUIZ LENO SILVA DE FARIAS (Luiz Leno Silva de Farias) ,Culturas Afro-Brasileiras ,CE ,Eleito ,259
LUZILEIDE ALVES DA SILVA (LUZILEIDE ALVES DA SILVA) ,Culturas Afro-Brasileiras ,RO ,Habilitado ,0
MANOEL DOMINGUES (Manoel Domingues) ,Culturas Afro-Brasileiras ,SP ,Habilitado ,17
MARA JOVANKA DA COSTA RODRIGUES (mara jovanka da costa rodrigues ) ,Culturas Afro-Brasileiras ,RN ,Habilitado ,12
MARCELO DOMINGUES DE MORAES MARINHO (Marcelo Domingues de Moraes) ,Culturas Afro-Brasileiras ,RJ ,Habilitado ,1
MARCELO LIMA DOS ANJOS (Marcelo Lima dos Anjos) ,Culturas Afro-Brasileiras ,DF ,Habilitado ,1
MARCOS ANTONIO COSTA (Ogan Marcos Gallo) ,Culturas Afro-Brasileiras ,SP ,Habilitado ,5
MARCOS ANTONIO SILVA AMORIM (marcos antonio silva amorim) ,Culturas Afro-Brasileiras ,CE ,Habilitado ,181
MARIA DA CONCEICAO APARECIDA GOMES (Conceição Gomes) ,Culturas Afro-Brasileiras ,RJ ,Habilitado ,16
MARIA DAS GRACAS PEREIRA BAHIA (Mãe Yatylyssá) ,Culturas Afro-Brasileiras ,RR ,Eleito ,63
MARIA DO SOCORRO MARQUES TORRES (Iyá Medjejí Tobí ty ÒSUN) ,Culturas Afro-Brasileiras ,PB ,Eleito ,21
MARIA JOZINEIDE LEITE DE ARAUJO (JOZINEIDE ARAÚJO) ,Culturas Afro-Brasileiras ,AP ,Habilitado ,1
MARIA LIDIANE APOLINARIO DA SILVA (Maria Lidiane Apolinário da Silva ) ,Culturas Afro-Brasileiras ,RN ,Habilitado ,1
MARIA LUCIA GOES BRITO (maria lucia goes brito) ,Culturas Afro-Brasileiras ,BA ,Habilitado ,32
MARIA LUCIA SANTOS DO NASCIMENTO (maria Lucia santos do nascimento) ,Culturas Afro-Brasileiras ,RN ,Inabilitado ,6
MARIA LUCIA SIMAO PEREIRA (Maria Lúcia Simão Pereira) ,Culturas Afro-Brasileiras ,CE ,Habilitado ,121
MARIANO DE RIBAMAR LINDOSO FRAZAO (Mariano Frazão) ,Culturas Afro-Brasileiras ,MA ,Habilitado ,27
MARICELMA FRANCISCO (Maricelma Francisco) ,Culturas Afro-Brasileiras ,SC ,Eleito ,6
MARILEIA FERREIRA DA SILVA (Ìyá Mary Léia de Òṣùmàrè) ,Culturas Afro-Brasileiras ,GO ,Eleito ,46
MARILSA SANTANA DOS SANTOS (Marilsa Santana dos Santos) ,Culturas Afro-Brasileiras ,RO ,Eleito ,3
MATEUS TAYSLAN ANDRADE DE CARVALHO (Mateus Tayslan ) ,Culturas Afro-Brasileiras ,SE ,Inabilitado ,16
MAURO DOS SANTOS VIANA (Mauro dos Santos Viana) ,Culturas Afro-Brasileiras ,RJ ,Habilitado ,1
MIGUEL ANGELO SILVA DE MELO (Miguel Ângelo Silva de Melo) ,Culturas Afro-Brasileiras ,CE ,Habilitado ,59
NILDELENE JOVEM DOS SANTOS (Nildelene Jovem dos Santos) ,Culturas Afro-Brasileiras ,RJ ,Habilitado ,0
NINA CARDOSO AMARAL DE SOUZA (Mãe Nina Souza) ,Culturas Afro-Brasileiras ,AP ,Eleito ,387
NOELIA PIRES DA SILVA (Noelia Pires) ,Culturas Afro-Brasileiras ,BA ,Eleito ,144
PATRICIA DA SILVA BRITO (Patrícia Brito) ,Culturas Afro-Brasileiras ,SC ,Habilitado ,6
PAULO RENATO VITORIA (Paulo Renato Vitoria) ,Culturas Afro-Brasileiras ,GO ,Habilitado ,2
PAULO RICARDO DA SILVEIRA SILVA (Paulo Ricardo da Silveira Silva) ,Culturas Afro-Brasileiras ,RS ,Eleito ,156
PEDRO PAULO DA CUNHA CARVALHO (PEDRO PAULO DA CUNHA CARVALHO) ,Culturas Afro-Brasileiras ,AP ,Habilitado ,4
RAD ASSIS BRASIL UGARTE (Eduardo Brasil ) ,Culturas Afro-Brasileiras ,SP ,Habilitado ,16
RAIMUNDO PAULO MONTEIRO CORDEIRO (PAULO CORDEIRO) ,Culturas Afro-Brasileiras ,PA ,Habilitado ,147
REGINALDO SILVA GOMES (REGINALDO SILVA GOMES) ,Culturas Afro-Brasileiras ,MT ,Eleito ,15
RENATO SILVA GOMES (Renato Silva Gomes) ,Culturas Afro-Brasileiras ,DF ,Eleito ,230
RICHARD SILVA GOMES (RICHARD SILVA GOMES) ,Culturas Afro-Brasileiras ,RS ,Habilitado ,5
ROBERTO DE PAULA LINS FILHO (Roberto de paula lins filho) ,Culturas Afro-Brasileiras ,RJ ,Habilitado ,21
RODRIGO APARECIDO PETINATI (Rodrigo Aparecido Petinati) ,Culturas Afro-Brasileiras ,AL ,Eleito ,27
ROGER APARECIDO FERREIRA (Roger Cipó) ,Culturas Afro-Brasileiras ,SP ,Eleito ,70
RONILDO FERREIRA DOS SANTOS (RONILDO FERREIRA) ,Culturas Afro-Brasileiras ,AP ,Eleito ,237
ROSANGELA COSTA ARAUJO (Rosângela Costa Raujo) ,Culturas Afro-Brasileiras ,BA ,Habilitado ,64
RUSEVELT SILVA SANTOS (Rusevelt Silva Santos) ,Culturas Afro-Brasileiras ,PA ,Eleito ,173
SATIRA PEREIRA MACHADO (Sátira Pereira Machado) ,Culturas Afro-Brasileiras ,RS ,Habilitado ,55
SERGIO SOREANO BARRETO (SERGIO SOREANO ) ,Culturas Afro-Brasileiras ,SE ,Eleito ,36
SIDNEY FERREIRA DA SILVA (Sidney Ferreira da Silva) ,Culturas Afro-Brasileiras ,MG ,Habilitado ,2
SILVANY EUCLENIO SILVA (SILVANY EUCLENIO) ,Culturas Afro-Brasileiras ,SP ,Eleito ,83
SILVIA CRISTINA PINHEIRO PEREIRA (Silvia Pinheiro) ,Culturas Afro-Brasileiras ,MA ,Habilitado ,28
SILVIO DA SILVA MORAIS (OJÚ OBÁ - SÍLVIO MORAIS) ,Culturas Afro-Brasileiras ,DF ,Habilitado ,25
TATIANE PEREIRA DE SOUZA (Tatiane Souza) ,Culturas Afro-Brasileiras ,SP ,Habilitado ,14
THOMPSON MESSIAS DE ARAUJO SANTOS (THOMPSON MESSIAS DE ARAUJO SANTOS) ,Culturas Afro-Brasileiras ,MT ,Habilitado ,3
VALERIA EURIPEDES SOUSA SANTOS (Valéria da Congada) ,Culturas Afro-Brasileiras ,GO ,Eleito ,30
VANDA LUCIA DOS SANTOS SOARES (Mãe Vanda) ,Culturas Afro-Brasileiras ,PA ,Eleito ,23
VILDE DORIAN DA SILVA CASTRO (Vilde Dorian da Silva Castro) ,Culturas Afro-Brasileiras ,RJ ,Habilitado ,2
WAGNER PEREIRA DA SILVA (Babalorixá Wagner de Oxum) ,Culturas Afro-Brasileiras ,CE ,Habilitado ,60
WALDENILTON FERREIRA MOTA (DANILO MOURA) ,Culturas Afro-Brasileiras ,BA ,Habilitado ,115
WALLACE DA CONCEICAO (Wallace da Conceição) ,Culturas Afro-Brasileiras ,ES ,Habilitado ,1
WALTER HUGO DIAZ PINAYA (Walter Pinaya / Walter t' Sàngó Agandjú) ,Culturas Afro-Brasileiras ,RS ,Eleito ,74
WICSON NUNES DE JESUS (Wicson Juventude de Terreiro ) ,Culturas Afro-Brasileiras ,BA ,Habilitado ,71
WILSON RICARDO FERNANDES DE OLIVEIRA (Ricardo de Laalu) ,Culturas Afro-Brasileiras ,SP ,Habilitado ,16
WILTON CORDEIRO DE SOUZA (Wilton Cordeiro de Souza) ,Culturas Afro-Brasileiras ,AL ,Eleito ,18
ACYR OSMAR DE OLIVEIRA (Acyr Osmar de Oliveira) ,Culturas Populares ,SC ,Eleito ,142
AFONSO FERNANDO ALVES DE OLIVEIRA (AFONSO FERNANDO ALVES DE OLIVEIRA) ,Culturas Populares ,PE ,Habilitado ,145
AFONSO MIGUEL AGUIAR (AFONSO MIGUEL AGUIAR) ,Culturas Populares ,PI ,Habilitado ,16
AILA CAROLINE PALHETA CORREA (Aila Caroline palheta correa) ,Culturas Populares ,AP ,Habilitado ,12
ALEX GOMES GONTIJO (Alex Gomes Gontijo) ,Culturas Populares ,GO ,Habilitado ,54
ALEXANDRE TESTA ACAMPORA (Alexandre Acampora) ,Culturas Populares ,TO ,Eleito ,1
ALEXSANDRO ROCHA DE AZEVEDO (Alexsando Rocha de Azevedo) ,Culturas Populares ,RJ ,Habilitado ,3
ANA LUCIA PEREIRA PICANCO (Ana Lucia Pereira Picanço) ,Culturas Populares ,MT ,Habilitado ,9
ANA MARIA AVIZ DO ROSARIO (Dona Ana do Rosário) ,Culturas Populares ,PA ,Eleito ,37
ANDERSON ROBERTO DA SILVA (Wuãnder Eletro tintas) ,Culturas Populares ,SP ,Habilitado ,1
ANTONIO AMADOR DE OLIVEIRA (antonio amador de oliveira) ,Culturas Populares ,AM ,Habilitado ,7
ANTONIO MARCOS GOMES DA SILVA (MARCOS GOMES) ,Culturas Populares ,CE ,Habilitado ,17
AORELIO DOMINGUES DE BORBA (Aorelio Domingues) ,Culturas Populares ,PR ,Eleito ,52
APARECIDA TEIXEIRA DE FATIMA PARAGUASSU (Aparecida Teixeira de Fatima Paraguassu) ,Culturas Populares ,GO ,Eleito ,130
ARISTANAN PINTO NERY DA SILVA (ARISTANAN PINTO NERY DA SILVA) ,Culturas Populares ,BA ,Eleito ,128
ARTUR MARTINS GARCEZ (Artur Martins Garcez) ,Culturas Populares ,RN ,Habilitado ,50
AURIMAR FIDELIS DE ARAGAO (Aurimar Fideles de Aragão) ,Culturas Populares ,AC ,Habilitado ,37
AVINNER AUGUSTO DA SILVA ALBINO (Avinner Augusto da Silva Albino) ,Culturas Populares ,MT ,Eleito ,36
CAMILA FERNANDA DE SOUZA (Camila Fernanda de Souza) ,Culturas Populares ,SP ,Eleito ,75
CARLA BATISTA DE PAULA (Carla Conorí) ,Culturas Populares ,AM ,Eleito ,161
CELESTE AIDA AMORIM MARQUES GONTIJO (Celeste Aida Amorim Marques Gontijo) ,Culturas Populares ,MG ,Habilitado ,17
CELIVIO HOLZ (CELIVIO HOLZ ) ,Culturas Populares ,SC ,Habilitado ,7
CICERO DE FARIAS FRANCA (Cicero de Farias Franca) ,Culturas Populares ,AC ,Eleito ,87
CLAIR HAHN FERMIANO (Clair hahn fermiano) ,Culturas Populares ,SC ,Eleito ,78
CLODOALDO SILVA DE SOUZA (CLODOALDO SILVA DE SOUZA) ,Culturas Populares ,PA ,Habilitado ,48
CRISTIANO MARTINS DE SOUZA (cristiano m de souza ) ,Culturas Populares ,GO ,Habilitado ,9
DENISE ELVIRA DE OLIVEIRA (Denise Elvira de Oliveira) ,Culturas Populares ,MG ,Habilitado ,13
DINA MARIA MARTINS LIMA (Dina Maria Martins Lima) ,Culturas Populares ,CE ,Eleito ,40
EDGAR MAROSTICA (Edgar Maróstica) ,Culturas Populares ,RS ,Habilitado ,83
EDUARDO JOSE BARBOSA (Bob Controversiata) ,Culturas Populares ,SP ,Habilitado ,50
EDUARDO MANOEL DA SILVA (eduardo manoel da silva ) ,Culturas Populares ,PE ,Eleito ,828
ELIAS PONTES DE CERQUEIRA (Akinyàlé Elias) ,Culturas Populares ,SP ,Habilitado ,3
ELVIS DOS SANTOS PEREIRA (ELVIS DOS SANTOS PEREIRA) ,Culturas Populares ,AL ,Habilitado ,88
ENEIDA PAES E LIMA (Eneida Paes e Lima) ,Culturas Populares ,SP ,Habilitado ,1
ERLIER JODSON SILVA SANTOS (erlier jodson silva santos) ,Culturas Populares ,AP ,Eleito ,134
FABIANA MENINI TRINDADE (fabiana menini) ,Culturas Populares ,RS ,Eleito ,100
FERNANDO CESAR DE OLIVEIRA (FERNANDO CESAR DE OLIVEIRA) ,Culturas Populares ,PR ,Habilitado ,0
FRANCILEY PAULO DE OLIVEIRA PEREIRA (Franciley Paulo de Oliveira Pereira) ,Culturas Populares ,AM ,Habilitado ,1
FRANCISCO ARTUR PINHEIRO ALVES (FRANCISCO ARTUR PINHEIRO ALVES) ,Culturas Populares ,CE ,Habilitado ,23
FRANCISCO GOMIDES FRANCA (Francisco Gomide França) ,Culturas Populares ,MG ,Habilitado ,9
